PMID,Title,Abstract,Year,Authors,Journal
40972296,Climate adaptation in the Colorado Plateau region: Insights from natural resource practitioners on adaptation planning and current challenges.,"Climate adaptation has been interpreted and applied in various ways within natural resource management. Previous research has not fully addressed how these different interpretations by individuals and agencies affect adaptation planning and efforts. Our study aims to address these challenges by investigating barriers to defining and interpreting adaptation comprehensively, utilizing the conceptual foundation of transformative adaptation. We used a mixed-methods research approach involving semi-structured interviews and a survey. The research participants were natural resource practitioners working on the public lands on the Colorado Plateau in the Southwestern U.S. Results showed that current land management strategies utilized by federal and state agencies pose challenges for adopting effective climate adaptation actions, and the concept of adaptation is applied and utilized in diverse ways that are not always beneficial to ecological adaptation. Our analysis indicates that current federal policies and pre-existing management priorities are central barriers to proactive adaptation in the region, where novel approaches were limited in favor of business-as-usual practices. Our study builds on existing literature that shows a present gap in natural resource planning and action on the ground due to barriers to defining adaptation, as well as how adaptation is often used to conduct business-as-usual strategies instead of taking proactive actions.",2025,Anna Lynn Vaughn; Brian Petersen,Journal of environmental management
40972211,Valve gaping behavior of bivalves under compound marine heatwaves and acidification extremes.,"Rapid increases in atmospheric carbon dioxide have led to more frequent and severe extreme weather events, such as marine heatwaves (MHWs) and ocean acidity extremes (OAXs), which can devastate marine ecosystems and cause significant socioeconomic impacts. Infaunal bivalves are crucial for benthic-pelagic coupling in marine ecosystems, yet their responses to extreme weather events are poorly understood. In this study, we employed high-frequency, non-invasive valvometry to investigate how Manila clams (Ruditapes philippinarum) behave in response to MHWs and OAXs. Long-term, real-time monitoring showed that initial exposure to MHWs notably reduced valve-gaping activity, though these effects diminished with repeated exposure. OAXs alone significantly impacted the proportion of open valves, but when combined with MHWs, they had a more pronounced effect on individual valve-gaping activity. These results suggest that Manila clam behavior is sensitive to both MHWs and OAXs, particularly when occurring together, highlighting the potential for developing an early-warning system based on valvometry.",2025,Yang Xu; Xin Luo; Yu He; Xiaoning Zang; Weiguo Lin; Yong Liu; Liqiang Zhao,Marine environmental research
40972210,"Reef geomorphology, hydrodynamic energy and coral morphology influence recovery after bleaching.","As climate change intensifies, mass coral bleaching events are becoming more frequent and severe, driving global reef decline. Post-bleaching outcomes vary widely across reef systems and individual colonies, complicating conservation efforts. Few studies integrate physical factors (site-specific geomorphology, hydrodynamics) with biological ones (coral physiology) to understand their interactions and combined effects on coral recovery. This study examines how local environmental conditions and coral traits influence post-bleaching outcomes at One Tree Reef in the southern Great Barrier Reef, following the extreme 2024 heatwave. Surveys were conducted during and after the bleaching event across three geomorphically distinct sites with varying hydrodynamics. To assess coral response, 462 colonies were tagged and monitored over nine months post heat-stress. Coral responses were compared between two morphotypes - simple and complex - based on how they interact with water flow. Results show that geomorphology and water flow modulate seawater temperatures and strongly influence coral recovery. The site with the greatest depth range (3-5 m) and highest flow had the highest number of healthy corals nine months post-bleaching, although outcomes were not stratified by depth. Between the two shallower sites (1-3 m), the one exposed to swell waves supported greater recovery over the following months, while the site with no wave energy experienced high mortality. Both simple and complex morphotypes benefited from higher hydrodynamic energy, with simple colonies generally more resilient to heat stress. These findings emphasise the importance of physical site-specific characteristics in coral resilience and can guide more effective conservation and restoration strategies under future climate stress.",2025,Liav Meoded-Stern; Ana Paula Silva; Shawna A Foo; Alexander Waller; Maria Byrne; Ana Vila-Concejo,Marine environmental research
40972205,Risk-based framework to determine climate-informed design storms for road drainage infrastructure.,"Climate change is amplifying extreme precipitation events in many regions and imposes substantial challenges for the resilience of road drainage infrastructure. Conventional design storm methodologies, which rely on historical trends of rainfall data under a stationarity assumption, may not adequately account for future climate change and variability. This study introduces a risk-based framework for determining climate-informed design storms tailored to road drainage systems. The proposed framework integrates climate model projections with risk assessment to quantify the potential impacts of future extreme rainfall on drainage performance and adjust the future design storm, with a focus on the province of Ontario, Canada. Projected precipitation changes for mid- and late-century time horizons are quantified using statistically downscaled CMIP6 General Circulation Models (GCMs). The risk level is defined as a function of hazard and vulnerability, where hazard combines both physiographic and meteorological factors. Vulnerability is composed of socioeconomic, transportation, and environmental considerations. To systematically integrate these components, a weighting scheme is developed based on a sensitivity analysis of the criteria, which provides flexibility in assigning relative importance to each factor. The estimated risk level is then applied to adjust projected design storm accordingly. The proposed workflow is demonstrated through both province-wide and site-specific applications across Ontario's road network to better highlight its scalability and adaptability. The findings signify the necessity of shifting from static, stationarity-based design methodologies to dynamic, risk-informed approaches that enhance the long-term resilience of transportation networks.",2025,Mohammad Fereshtehpour; Rashid Bashir; Neil F Tandon,The Science of the total environment
40972192,"Assessing the impact of digitalization, geography, and digital mobility on air pollution in Europe & Central Asia: A climate change perspective.","Air pollution has increasingly become a significant driver of global warming, particularly due to the rapid expansion of industrial activities and unsustainable urbanization. This study aims to examine the influence of digitalization, digital mobility, and geography on air pollution across 40 European & Central Asian countries, using Panel-Corrected Standard Errors (PCSEs) to analyze panel data from 1995 to 2023. The findings reveal that, individually, digitalization, digital mobility, and geographical factors significantly contribute to increased air pollution levels in the region, resulting in rising temperatures and posing serious risks to human health and the environment. Notably, while underdeveloped digital infrastructure may amplify the environmental burden-particularly when compounded by geographic constraints-advanced digitalization can mitigate pollution through more efficient digital mobility and cleaner technologies. Moreover, the threshold effect suggests that digitalization must reach a sufficient level to mitigate effectively or potentially exacerbate the intensifying impact of digital mobility and geographical constraints on air pollution. Additionally, the analysis finds bidirectional causality between air pollution and the main explanatory variables: digitalization, digital mobility, and geography. Conversely, control variables such as fixed capital formation and GDP are associated with reductions in air pollution, while final consumption and population growth are found to exacerbate it. Policymakers are encouraged to leverage digital transformation not only for economic growth but also as a strategic tool to combat climate change and support sustainable development.",2025,Umer Shahzad; Changhong Miao,The Science of the total environment
40971986,Photoperiod does not affect thermal acclimation of shoot-scale gas exchange but is important for shoot development in cuttings of Norway spruce (Picea abies (L.) H. Karst).,"The growth of boreal trees is expected to benefit from increasing global temperatures through enhanced photosynthetic rates and longer growing seasons. However, since photoperiod is independent of climate change, it may limit the expected growth benefits from a longer growing season and could thus constrain boreal trees' physiological responses to warming. We carried out a growth chamber experiment on two-year-old Norway spruce (Picea abies) cuttings from two latitudinal origins to investigate the interaction between day length (20/4 hours vs 14/10 hours light/dark) and enhanced temperatures (25/20 °C vs 15/10 °C day/night) on height growth, bud development and shoot-scale gas exchange. Height growth was greater under longer day length while bud development occurred faster both under longer day length and higher growth temperature. Growth temperature did not have a significant effect on the light-saturated photosynthetic rate but higher growth temperature resulted in lower dark respiration rate. Cuttings in the low growth temperature treatment exhibited higher apparent quantum yields indicating that lower growth temperature benefited net carbon uptake under low light availability, such as the conditions experienced by seedlings growing in the forest understory. Day length did not influence the thermal acclimation of shoot-scale gas exchange. The two populations from different origins did not differ in the measured parameters, except for a higher dark respiration rate in the high latitude cuttings. Overall, while day length did not affect the thermal acclimation of photosynthetic processes, it appears to constrain height growth and bud development, thereby reducing the potential performance benefit of a warming-induced lengthening of the growing season.",2025,Astrid Fridell; Göran Wallin; Curt Almqvist; Lasse Tarvainen,Tree physiology
40971876,"Discrepancy between active trachoma and tests of chlamydial infection in Alto Amazonas, Peru.","Trachoma mapping in Latin America is incomplete, especially in indigenous communities of the Amazon thought to be at highest risk. The aim of this study was to determine the prevalence of clinical, microbiological, and serologic evidence of trachoma in a remote area of the Peruvian Amazon. A population-based sample of households from rural communities in Alto Amazonas province was selected using two-stage cluster sampling. In children aged 1-9 years, conjunctival photographs, conjunctival swabs, and dried blood spots were collected. Photographs were graded for trachomatous inflammation-follicular (TF). Swabs were processed for Chlamydia trachomatis with a nucleic acid amplification test. Dried blood spots were assessed for antibody responses to C. trachomatis with a multiplex bead assay. A total of 778 children aged 1-9 years from 21 communities participated. The age-adjusted prevalence of TF among 1-9-year-old children was 25.4% (95%CI 21.3-29.5%), compared with 0.8% (95%CI 0.5-1.0%) for ocular C. trachomatis and 6.6% (95%CI 4.5-9.0%) for Pgp3-specific antibodies to C. trachomatis. This region of the Peruvian Amazon had a high burden of clinical trachoma but low levels of C. trachomatis ocular infection and seropositivity.",2025,John M Nesemann; Noelia Morocho-Alburqueque; Alvaro Quincho-Lopez; Dionna M Wittberg; Harvy A Honorio-Morales; Salomón Durand; Martha Idalí Saboyá-Díaz; Silver K Vargas; Fisseha Admassu; Ana Bakthiari; Cristina Jimenez; Emma M Harding-Esch; Sandra L Talero; Marlene Muñoz; Anthony W Solomon; Jeffrey D Klausner; Andres G Lescano; Jeremy D Keenan,Clinical infectious diseases : an official publication of the Infectious Diseases Society of America
40971633,Inclusion of climate change and planetary health in masters of public health curricula in the UK.,"Due to the many health impacts of climate change, it is imperative to equip public health professionals with the skills and knowledge to work on climate mitigation and adaptation. However, it is unclear to what extent Masters of Public Health (MPH) include climate change and related subjects in their curricula. A survey was sent to MPH directors in the UK with questions about inclusion of climate change and related subjects in the curriculum. Russell group universities and those commissioned by NHS England Workforce, Training and Education were invited to take part. A total of 27 MPH courses were included (100% response rate). Climate change and related subjects were included in optional or core modules on other subjects, with health protection and health improvement being the most common. Two MPHs had only one lecture/seminar on climate change and one MPH did not cover these topics in the syllabus. The most common subject included in curricula was climate change (24, 89%). Most MPH directors wanted to increase the inclusion of climate change and planetary health in the curriculum (12, 55%) but could not do so due to lack of space within an already overloaded curriculum (10, 37%). Despite the recognition of the importance of climate change and health education by MPH course directors, the inclusion of those subjects in curricula remains variable and not as thorough as required given the importance of the topic. Addressing barriers is warranted to enable public health professionals to gain the required skills in climate mitigation and adaptation.",2025,Ana-Catarina Pinho-Gomes; Cecilia Sorensen; Danielly de Paiva Magalhães; Shakoor Hajat; Harry Rutter,European journal of public health
40971202,Factors relating to climate change anxiety in women at reproductive age: A CHAID analysis.,"This study aimed to determine the factors relating to climate change anxiety in women at reproductive age. This study is descriptive and cross-sectional. This study included 351 women aged 18-45 years. Data were collected via face to face interviews using the 'Women's Descriptive Characteristics and Climate Change Perception Assessment Form' and 'Climate Change Anxiety Scale for Women's Health' between June and October 2024 at a family health center in Mersin province of Türkiye. Data analysis included descriptive statistical methods and chi-squared automatic ınteraction detector analysis. The average age of the women was 27.91 ± 8.30 years (n = 351). The Climate Change Anxiety Scale for Women's Health mean score was 52.46 ± 17.19. Women's experience of anxiety regarding the negative consequences of climate change affected the scale and all sub-dimensions (physiological health, behavior, and gender) (p < 0.05). Health professionals should provide information and assessments including the effects of climate change on health in care services. They should plan interventions to reduce women's anxiety levels towards climate change.",2025,Tuğçe Sönmez; Enes Karaman,Revista da Escola de Enfermagem da U S P
40970595,Prevention or relief? Voters' support for disaster policies.,"Researchers have argued that preventing disasters is more efficient than providing relief. Yet, previous scholarship has found that voters in the United States reward politicians more for relief than for prevention policies. It is unclear, however, whether they truly favour relief policies or if they are simply more aware of them. In this article we report on an experiment in which American participants read about a fictional community facing a threat of flood and then rated their support for a disaster policy. Across conditions, we manipulated whether the policy is for relief or prevention, and whether the citizens are cooperative or uncooperative with respect to government policies. We found that participants did not support relief more than prevention; in fact, they favoured prevention when citizens were uncooperative. In addition, participants were less supportive of relief for uncooperative as compared to cooperative citizens, while cooperativeness did not affect support for the prevention policy.",2026,H Hana Kim; James Cragun; Peter DeScioli,Disasters
40970586,Response of nitrogen-fixing plant symbioses to changing temperature.,"Symbiotic nitrogen fixation (SNF) is an effective strategy for legumes and actinorhizal plants to acquire atmospheric nitrogen (N<sub>2</sub>) for their growth and development. Like other enzymatic processes in roots, the efficiency of SNF is highly dependent on soil temperature. Since global atmospheric temperature change also affects soil temperature, it is essential to know the temperature response of different types of plant-microbial symbioses capable of SNF at the molecular, physiological, and ecosystem levels on air and soil temperature changes. This is of particular significance, because the ability of nitrogen-fixing microbial symbionts to deal with temperature changes in the soil can affect growth and development of legumes and actinorhizal plants and, hence, the sustainability of ecosystems in a changing climate. However, temperature response may differ between different groups of nitrogen-fixing microbial symbionts (e.g., rhizobia vs. Frankia) and between different strains of the same microbial symbiont. In the present review, we summarize current knowledge on the temperature response of SNF, describe unexplored research topics, and propose future basic and applied research avenues under controlled conditions and in field studies. It provides a holistic view on the subject to encourage interdisciplinary research on this subject which has been largely neglected during the last decades, but of increasing significance due to global climate change.",2025,Tong Peng; Heinz Rennenberg; Bin Hu,Journal of integrative plant biology
40970515,"Climate-Driven Variability in Flowering Phenology Changes Across Subtropical Mountains: Traits, Elevation Shifts, and Biogeographic Patterns.","Flowering phenology has major impacts on physiological processes, survival, and reproductive success in angiosperms, serving as a critical biological indicator of climate change impacts. However, changes in flowering phenology and their determinants in subtropical montane ecosystems remain poorly quantified at continental extents. Here we investigated the determinants of flowering phenology shifts over the past century across 11 subtropical mountains in China. Based on century-long herbarium collections of 784 flowering plant species in these mountains, we first used linear regression models to assess the magnitude and direction of changes in flowering time for each species in each mountain separately. Then, we investigated the underlying drivers of changes in flowering time, including climate changes, species traits as well as changes in species elevation range size. Our analyses revealed an average advancement in flowering phenology of 3.8 days per decade, though marked regional disparities emerged: flowering times were advanced in southeastern mountains but delayed in southwestern ones. Climate change, species functional traits, and mountain properties all had significant effects on the observed changes in flowering time. Notably, the flowering time of lowland and non-native plants was advanced more than that of alpine and native plants. A key finding was the negative correlation between flowering time changes and elevational range expansions, supporting the hypothesis that phenological plasticity facilitates range adjustments under environmental change. These findings demonstrate that flowering phenological responses are context-dependent, mediated by complex biotic-abiotic interactions. Our study provides the first biogeographical assessment of flowering phenology shifts in subtropical Asian mountains, offering critical insights for predicting ecosystem stability and informing biodiversity conservation strategies under ongoing climate change.",2025,Kuiling Zu; Zhiheng Wang; Fusheng Chen; Jonathan Lenoir; Xiangmin Fang; Fangchao Wang; Wensheng Bu; Jianjun Li; Yuan Luo; Yunyun Wang; Wenqi Song,Global change biology
40970348,Homoploid Hybrid Speciation in a Marine Pelagic Fish.,"Homoploid hybrid speciation (HHS) is an enigmatic evolutionary process where new species arise through hybridisation of divergent lineages without changes in chromosome number. Although increasingly documented in various taxa and ecosystems, convincing cases of HHS in marine fishes have been lacking. This study presents a possible case of HHS in a pelagic marine fish based on comprehensive genomic, morphological, and ecological analyses. Population genomics, species tree estimation, and tests of introgression and admixture identified three sympatric clusters in Megalaspis cordyla in the western Pacific and the admixed nature of one cluster between the others. Moreover, model-based demographic inference favoured a hybrid speciation scenario over introgression for the origin of the admixed cluster. While contemporary gene flow suggested partial reproductive isolation, examination of occurrence data and ecologically relevant morphological characters suggested ecological differences between the clusters, potentially contributing to the reproductive isolation and niche partitioning in sympatry. The clusters are also morphologically distinguishable and thus can be taxonomically recognised as separate species. The hybrid cluster is restricted to the coasts of Taiwan and Japan, where all three clusters coexist. The parental clusters are additionally found in lower latitudes, where they display non-overlapping distributions. Given the geographical distributions, estimated times of species formation, and patterns of historical demographic changes, we propose that the Pleistocene glacial cycles were the primary driver of HHS in this system. We also develop an ecogeographic model of HHS in marine coastal ecosystems, including a novel hypothesis to explain the initial stages of HHS.",2025,Nozomu Muto; Yong-Chao Su; Harutaka Hata; Nguyen Van Quan; Veera Vilasri; Mazlan Abd Ghaffar; Ricardo P Babaran,Molecular ecology
