PMID,Title,Abstract,Year,Authors,Journal
40966872,"Habitat degradation and quality assessment of Khyargas Lake, Western Mongolia and adjacent terrestrial and freshwater areas.","Lakes in Western Mongolia have international significance as they provide an important stopover for numerous migratory bird species. These wetlands also have a primary role in acting as an ecological regulator for maintaining water regimes and habitats which directly impact the level of biodiversity, ecological functionality and climate change resilience of the surrounding environments. This study evaluates the habitat quality and degradation status over the period of 2002-2022 of Khyargas Lake, the second-largest brackish lake in Mongolia, and its terrestrial and interconnected freshwater surroundings, using the InVEST (Integrated valuation of ecosystem services and trade-offs) model. We used satellite images to analyse land cover changes and threat sources, estimating their maximum distance of impact and sensitivity score for each threat source within land cover types. The results indicate that steppe and dry steppe regions are transitioning toward semi-desert conditions, suggesting that the area may be experiencing aridification. By 2022, an estimated 11.1 % of the total study area was identified as exhibiting varying degrees of habitat degradation. We identified a particular risk of habitat quality losses around Khyargas Lake, where most tourism activities are present, and in areas with dry steppe and desert steppe land cover. Identifying areas of varying habitat quality and determining threats can help shape guide conservation and restoration efforts at Khyargas Lake more effectively. This may assist decision-makers in reducing the potential impact of human activities on habitat quality.",2025,Purevsuren Munkhtur; Maartje Oostdijk; David Cook,Journal of environmental management
40966808,Techno-economic assessment and life cycle analysis of a corncob-based xylitol biorefinery.,"A detailed techno-economic analysis and life cycle assessment of a proposed xylitol biorefinery from corncob biomass was performed. The calculations are based on a plant with 20 t of corncob as the feed. Based on the simulation analysis, the commercial plant was estimated to produce ∼209 t of food-grade xylitol annually. The selling price of xylitol was calculated to be Rs 375/kg of crystals, which would achieve a payback of less than 5 years with a high internal rate of return. The environmental impacts calculated from the plant showed GHG emissions of ∼7.67 kg CO<sub>2</sub> eq/kg of the crystals with low water footprint and other ecotoxicities. The electrical and steam utilities involved in different unit operations within the plant were the major contributors towards CO<sub>2</sub> emissions and the operating cost. The results illustrated that the plant would have favorable economics and can contribute towards sustainable xylitol production in India.",2025,Diptarka Dasgupta; Prasenjit Ghosh; Vishal Ahuja; Snehal More; Thallada Bhaskar,The Science of the total environment
40966802,A multi-source approach to groundwater storage and recharge assessment in the Volta Basin.,"Assessing groundwater storage changes is important in semiarid regions such as the Volta Basin in sub-Saharan Africa but can be challenging due to data scarcity. This study presents a multi-source approach combining NASA's Gravity Recovery and Climate Experiment (GRACE) mission data, Climate Hazards group Infrared Precipitation with Stations (CHIRPS) precipitation data, the new Global Land Data Assimilation System (GLDAS) v2.2 CLSM groundwater storage anomaly dataset, traditional non-groundwater terrestrial water storage components from GLDAS v2.1, and Copernicus satellite data for surface water dynamics to analyze groundwater storage changes and recharge rates in the Volta Basin. Our study reveals: (1) A small change in groundwater storage from 2002 to 2012, followed by a significant increase from 2012 to 2022; (2) A total groundwater increase of approximately 30 cubic kilometers or about 10 cm of liquid water equivalent over the entire study period; (3) Water storage in the basin is dominated by fluctuations in Lake Volta, which accounts for ∼50 % of terrestrial water storage; (4) Groundwater recharge rates estimated using the Water Table Fluctuation Method on GRACE- and GLDAS-derived data, aligned with values from monitoring wells and previous studies; (5) The GLDAS v2.2 dataset exhibits similar seasonal trends with periodic peaks and troughs, yet the amplitude of anomalies from GLDAS are larger compared to the GRACE dataset; and (6) Groundwater recharge shows a weak correlation with extreme precipitation events, suggesting more water percolates rather than evaporates during such events. However, other factors, including land use changes and agricultural practices, may also impact groundwater storage and recharge.",2025,Sergio A Barbosa; Norman L Jones; Gustavious P Williams; Henok Teklu; Sandow M Yidana; Sarva T Pulla; Jorge Luis Sanchez; E James Nelson; Daniel P Ames; A Woodruff Miller,The Science of the total environment
40966538,Critical Role of Land Management Practices in Augmenting China's Terrestrial Carbon Sink up to 2060.,"China's carbon neutrality goal hinges on augmenting its terrestrial carbon sink through land management practices and environmental changes. However, the magnitude of China's future terrestrial carbon sink and its contributing factors remain uncertain. Notably, there is a lack of appropriate tools to parse the contributions of individual land management practices (i.e., afforestation/reforestation, grassland grazing exclusion, and wood extraction) to China's future terrestrial carbon sink. Employing a process-based model, this study projected an increment of 84.8 Tg C yr<sup>-1</sup> in China's terrestrial carbon sink for 2021-2060 under the SSP1-2.6 scenario relative to the 2020 baseline of 224.1 Tg C yr<sup>-1</sup>. Land management practices, including afforestation and reforestation, reduced wood extraction, and grazing exclusion, were responsible for 96.8% of this increment, while environmental changes accounted for only 3.2% of this increment, with climate change nearly fully offsetting the contribution from atmospheric CO<sub>2</sub> growth. China's terrestrial carbon sinks were estimated to range from 289.8 to 339.8 Tg C yr<sup>-1</sup> during 2021-2060 under different land management practices and environmental conditions. These findings highlight the dominant role of land management practices in augmenting carbon sequestration and provide critical insights for developing climate policies that support China's carbon neutrality goals.",2025,Mengyang Xu; Pengyi Zhang; Junhao He; Chao Yue; Ziyu Zhang; Qi Tian; Feilong Shen; Zhongdian Zhang; Jie Zhao; Mengyu Wang; Lei Zhu; Yi Leng; Jiasheng Li; Lele Wang,Environmental science & technology
40966432,Balancing Cell Growth and Product Synthesis for Efficient Microbial Cell Factories.,"The sustainable, bio-based production of industrially valuable chemicals and materials from renewable, non-edible biomass through biorefineries has emerged as a vital strategy for tackling urgent global challenges, including climate change, and for realizing the ""net zero carbon"" commitments recently pledged by nations worldwide. Metabolic engineering has played a central role in enabling the development of microbial strains capable of efficiently overproducing a diverse array of target compounds. Nevertheless, engineered microbial cell factories often face inherent trade-offs between product synthesis and cell growth, frequently resulting in diminished fitness or loss-of-function phenotypes. This review highlights recent advances in metabolic engineering strategies aims at reconciling this conflict, encompassing pathway optimization, dynamic regulation, orthogonal system design, microbial consortia engineering, fermentation process control, and integrative metabolic modeling. It also explores the remaining challenges and future directions for reprogramming microbial metabolism to harmonize growth with high-level production.",2025,Linxia Liu; Dongqin Ding; Huiying Wang; Xinyi Ren; Sang Yup Lee; Dawei Zhang,"Advanced science (Weinheim, Baden-Wurttemberg, Germany)"
40966350,More extreme Indian monsoon rainfall in El Niño summers.,"Extreme rainfall during the Indian summer monsoon can be destructive and deadly to the world's third-largest economy and most populous country. Although El Niño events in the equatorial Pacific are known to suppress total summer rainfall throughout India, we show using observational data spanning 1901 to 2020 that, counterintuitively, they simultaneously intensify extreme daily rainfall. This is partly driven by increases in extreme daily values of convective buoyancy, provided that both the undilute instability of near-surface air and the dilution by mixing with drier air above are considered. El Niño could plausibly drive similar changes in other tropical regions, and our framework could be further applied to changes in hourly extremes, to other internal variability modes, and to forced trends under climate change.",2025,Spencer A Hill; Destiny Zamir Meyers; Adam H Sobel; Michela Biasutti; Mark A Cane; Michael K Tippett; Fiaz Ahmed,"Science (New York, N.Y.)"
40966344,Climate rather than overgrazing explains most rangeland primary productivity change in Mongolia.,"Rangelands are Earth's dominant land type, supporting the livelihoods of more than 2 billion people. Concerns about rangeland degradation typically focus on overgrazing. But climate change may be a greater culprit. Using spatially disaggregated, nationwide data from Mongolia, from 1984 to 2024, we exploited seasonal variation in grazing locations to quasi-experimentally estimate the causal effects of livestock herd size, weather, and climate change on rangeland primary productivity. At interannual frequency, herd size modestly but significantly negatively affects primary productivity, with notable variation across ecological zones. The effects of weather fluctuations are, however, an order of magnitude larger. At the decadal scale, over which herders can adapt to climate change, herd size effects disappear, and temperature effects dominate. In Mongolia, climate change seems to drive most long-term change in rangeland primary productivity.",2025,Avralt-Od Purevjav; Tumenkhusel Avirmed; Steven W Wilcox; Christopher B Barrett,"Science (New York, N.Y.)"
40966263,"Study protocol for an observational panel study of heat strain in the general adult population in Basse Santa Su, The Gambia.","Heat is among the most hazardous environmental factors for human health, but humidity's role in heat-related health effects remains unclear. This study will assess the effect of humid heat and other environmental conditions on health in a representative population in Basse Santa Su, The Gambia, a region at high risk of humid heat exposure. We will examine the association between humid heat exposure and physiological heat strain, identify vulnerable sub-groups, and evaluate adaptive behaviours. We will recruit 60-90 healthy adults from Basse Santa Su and surrounding areas. Participants will be monitored for four non-consecutive weeks across dry (November-May) and rainy (June-October) seasons. Daily questionnaires will assess activities, thermal comfort, adaptation behaviours, heat strain symptoms, mood, and sleep quality. Wearables will collect time-resolved personal and indoor exposure (temperature and humidity), heat strain, and further physiological covariates. A fixed monitoring network will measure outdoor air temperature, humidity, air quality, and environmental noise. Descriptive analyses will assess baseline characteristics, heat stress and heat strain. Case-time series analysis with distributed non-linear lagged models will estimate immediate and delayed associations between exposure to humid heat and physiological heat strain. Stratified analyses by individual characteristics will explore possible vulnerability groups. Multiple exposure models and interaction terms will explore cumulative effects of multiple environmental factors. Multilinear land use regression modelling will develop high-resolution maps of temperature, humidity, and heat stress. This study will provide new insights into humid heat's effect on health, particularly in low-income, high-exposure settings. This study addresses limitations in prior epidemiological research on heat, humidity, and health, including lack of high-resolution and individual-level data, and limited focus on humidity as a heat-health driver, on non-mortality outcomes and on climate-vulnerable populations. This study combines high-resolution microclimate mapping and individual-level measurements which may inform future epidemiological studies and heat-health interventions.",2025,Elisabeth Tadiri; Apolline Saucy; Ana Bonell; Philip Musa Sarjo; Bakary Sonko; Jonathan Vicente Dos Santos Ferreira; Moritz Burger; Moritz Gubler; Kelton Minor; Ana M Vicedo-Cabrera,PloS one
40966247,Scrub typhus in Nan province (Thailand): Seventeen years of data to understand the impact of land cover change.,"Scrub typhus, caused by Orientia tsutsugamushi and transmitted by chigger mites (Leptotrombidium), is a major health problem in northern Thailand, particularly in Nan province. Land cover change, by altering the ecosystem, could affect the ecology of the vector and consequently the risk of scrub typhus transmission. This study investigated the impact of land cover changes on scrub typhus transmission in 2.5 km buffer zones around each village of Nan Province between 2003 and 2019. Using the open land cover data of the European Spatial Agency Climate Change Initiative (ESA CCI), we quantified land cover composition and land cover changes and integrated public health data on scrub typhus cases, as well as information on elevation, population, and slope. Generalized Additive Models were applied to assess the effects of land cover changes on annual scrub typhus cases. Scrub typhus cases increased significantly during the study period, peaking in 2012 and 2016, mainly in mountainous areas rather than in the Nan River valley. Land cover associated with cases included shrubland, mosaic land, broadleaf forest, and needleleaf forest. Cases increased with shrubland and mosaic land, displayed an inverted U-shaped relationship with broadleaf forest, and decreased with needleleaf forest. Key land cover change factors included shrubland transitions, population, and geographic interactions. Reforestation (from shrubland to broadleaf forest) showed an inverted U-shaped relationship with cases, whereas stable broadleaf forest and loss of shrubland to grassland became non-significant. Male population increased cases. This study highlights the importance of land cover changes in understanding disease transmission and suggests that landscapes disturbance may create optimal conditions for O. tsutsugamushi transmission. This is a novel regional-scale exploration of land cover impacts on scrub typhus in Thailand.",2025,Nolwenn Blache; Karine Chalvet-Monfray; Rawadee Kumlert; Soawapak Hinjoy; Serge Morand,PLoS neglected tropical diseases
40966207,"Climate change, urbanisation and transmission potential: Aedes aegypti mosquito projections forecast future arboviral disease hotspots in Brazil.","Climate change and urban expansion pose significant challenges to controlling Aedes aegypti mosquito populations, a primary vector of arboviruses such as dengue, Zika, and chikungunya. This study aims assess how climate and anthropogenic factors will jointly shape Ae. aegypti densities in Brazil, which is crucial to forecasting transmission risks and informing public health strategies. This study combined a biologically informed, stage-structured delay-differential equation model with climate and anthropogenic data. Climate projections from the Coupled Model Intercomparison Project Phase 6 under different Shared Socioeconomic Pathways (SSPs) were used to forecast future climate scenarios from 2024 to 2080. Boosted Regression Trees integrated anthropogenic factors like urbanisation, population growth, and urban accessibility. Model outputs were validated with entomological surveillance data, and the basic reproductive number for dengue fever was used to assess changes in disease transmission potential. Our findings predicted that Ae. aegypti mosquito density will increase nationally, but unevenly, exceeding thermal limits in North Brazil while rising substantially in the South and Southeast. Increases in density were particularly pronounced under high greenhouse gas emission scenario SSP5-8.5 (up to 92% in the Southeast). These trends were projected to elevate the transmission potential for dengue fever, with Southeast Brazil facing the biggest increases due to mosquito population growth outpacing human population expansion. Validation against historical data confirmed model robustness. By directly linking mosquito abundance to SSP-specific emissions trajectories, our results show that climate mitigation can markedly reduce disease risk. Shifting from SSP5-8.5 to SSP1-2.6 could cut projected mosquito density increases from 31% to 11% nationally by 2080. The model's spatial granularity and integration of local administrative boundaries support its utility for national and sub-national health planning. Addressing compounded risks in vulnerable peri-urban and rural populations will require coordinated interventions that span climate policy, vector control, and health equity.",2025,Katherine Heath; Lincoln Muniz Alves; Michael B Bonsall,PLoS neglected tropical diseases
40966054,Planetary Health in Health Professions Education: A Review of Institutional Websites.,"Climate change is a public health crisis that health care professionals must be prepared to address. Academic programs for health professions have an opportunity to express commitment to addressing planetary health through website content. The purpose of this article is to describe how nursing and other health care education programs acknowledge planetary health on their websites. Nine website metrics were evaluated for top programs across 14 unique health care professions. Seventy university websites were reviewed. Nursing programs are most likely to share information about climate-related courses on their websites, but minimally include other metrics. Inclusion of website metrics for other health care professions varied greatly. Nurses are positioned to be leaders in planetary health. Without clear prioritization from institutions of higher learning, there remains a gap between patient needs and health care professionals' knowledge. Intentionally expressing a commitment to planetary health on websites can attract students who prioritize the issue, increasing the impact nurses and other health care professionals can have on planetary health.",2025,Heide Cygan; Aditi Jarayam; Andrew N Garman; Santosh Basapur,Nurse educator
40966010,Soil Microbiota From Warmer and Drier Grasslands Are More Vulnerable to Drought Stress.,"The stability of soil microbial communities under drought stress is critical for sustaining ecosystem function in a changing climate. However, it remains unclear whether long-term exposure to arid environments strengthens microbial drought resistance through adaptation, or instead diminishes it by reducing diversity and shifting functional redundancy. To address this, we sampled soil microbiota (including bacteria, fungi, and protists) communities along a 3600-km aridity and temperature gradient in Chinese grasslands, and assessed their compositional resistance to experimental drought. We found that microbiota drought resistance decreased with increasing aridity and temperature, particularly for bacteria and protists. This reduced resistance was attributed to declines in taxonomic diversity, larger microbiota body size, and compositional shifts toward oligotrophic taxa in drier regions. These findings suggest that structural shifts in soil communities associated with chronic arid climate may heighten vulnerability to acute drought events, potentially eroding ecosystem resistance as future climate extremes intensify.",2025,Xihang Yang; Yong Zhang; Xinyue Zhang; Yuting Wang; Xiang Liu; Mu Liu; Yao Xiao; Jihua Wu,Global change biology
40965905,Arctic Soil C and N Cycling Are Linked With Microbial Adaptations During Drought.,"Climate change increases the frequency and intensity of drought events, yet the mechanisms of microbe-mediated soil carbon (C) and nitrogen (N) cycling under drought are poorly understood. We conducted a microcosm experiment with a Greenlandic soil subjected to five levels of drought, reducing water content from 180% to 15% over the course of 3 weeks followed by rewetting, mimicking a natural drought event. We linked changes in microbial gene expression related to stress response as well as C and N cycling with greenhouse gas (GHG) emissions, extracellular enzyme activities, and soil C and N status. Maximum changes in gene expression occurred at intermediate levels of drought (80% water content), characterized by acclimation of microbial physiology to drought conditions, including production of osmolytes as well as cell wall and membrane modifications. This peak in gene expression changes marked a tipping point associated with a pronounced decline in microbial respiration as well as extracellular enzyme activities under more intense drought conditions. Interestingly, C-cycling gene expression correlated with soil dissolved organic nitrogen (DON), NH<sub>4</sub> <sup>+</sup>, NO<sub>3</sub> <sup>-</sup> and PO<sub>4</sub> <sup>3-</sup> contents. Moreover, N-cycling gene expression correlated with PO<sub>4</sub> <sup>3-</sup> contents and with the activity of laccases. These findings highlight linkages between microbial C, N, and P cycling because of stoichiometric constraints under drought. 24 h after rewetting, we found a shift in microbial expression of C usage genes towards more labile compounds, and an increase in genes related to anabolic activity and signaling, but no signatures of stress responses, suggesting that the microbial community had overcome rewetting-induced changes in osmotic pressure and allocated metabolic activity to growth. Overall, we show that microbial physiological drought responses and microbial resource usage related to C:N:P stoichiometry are key mechanisms of C and N cycling in the Arctic soil under drying and rewetting.",2025,Theis Thomsen; Morten Dencker Schostag; Anders Priemé; Jonathan Donhauser,Global change biology
40965706,Optimization and validation of a linear appraisal system for zoometric traits in dromedary camels.,"Linear appraisal scales focus on the qualitative assessment of specific traits along a standardized scale across animal populations. By minimizing errors and optimizing measurement procedures, these scales streamline resource allocation, saving time and costs for livestock managers and breeders, thereby facilitating informed breeding decisions and promoting genetic progress. A total of 130 adult, healthy dromedary camels (<i>Camelus dromedarius</i>) of the Canarian Camel breed were evaluated across three representative locations in Spain (Huelva, Almería, and Fuerteventura). The study aimed to optimize and validate a linear appraisal system (LAS) for assessing zoometric traits in dromedaries. Principal Component Analysis (PCA) revealed that none of the zoometric variables considered were discardable due to their ability to explain variability in the sample. However, some zoometric variables lacked statistically significant representation across one or more levels within the linear appraisal scale. Therefore, a proposal for optimizing the linear appraisal scale involves reducing the number of initially proposed linear categories for these variables. Correlation analysis revealed high internal consistency (Intraclass Correlation Coefficient (ICC) ≥ 0.7), confirming significant agreement between zoometric variability-based scales and linear appraisal traits, thus validating the LAS. Notably, interobserver reliability varied across zoometric traits, with lower agreement (ICC < 0.5) observed in apical body regions, which are more prone to movement during evaluation. Overall, our findings underscore the potential of LAS as a robust tool for zoometric evaluation in dromedary camels, aiding in the selection of superior individuals for breeding. In this context, the LAS provides a valuable framework to improve phenotypic characterization of dromedary camels, a livestock species of growing global interest due to its resilience to climate change and its longstanding role as a socio-economic cornerstone in arid and semi-arid production systems. The online version contains supplementary material available at 10.1007/s11250-025-04628-9.",2025,Carlos Iglesias Pastrana; Francisco Javier Navas González; Elena Ciani; José Manuel León Jurado; Juan Vicente Delgado Bermejo,Tropical animal health and production
